{
  "meta": {
    "title": "LAB SEVEN for Experience Agencies | Labrador Field Systems",
    "description": "Silent battery power for brand activations and experiential events. Get approved for impossible locations without generator drama."
  },
  "hero": {
    "title": "Power immersive experiences anywhere",
    "tagline": "No refueling. No noise. More power than a 7000 watt generator. 60A silent power for brand activations, pop-ups, and installations. No permits, no noise complaints, no limits.",
    "cta": {
      "primary": {
        "text": "Contact Labrador",
        "href": "#contact"
      },
      "secondary": {
        "text": "Book a Demo",
        "href": "#contact"
      }
    }
  },
  "benefits": {
    "title": "Built for experiential marketing",
    "items": [
      {
        "icon": "âœ“",
        "title": "Get approved for impossible locations",
        "description": "Hotels, rooftops, retail spaces, historic buildings. Silent operation means yes from venues that always say no to generators."
      },
      {
        "icon": "ðŸŽ¯",
        "title": "Protect the brand experience",
        "description": "Your activation isn't competing with generator noise. Guests hear the music, the message, the momentâ€”not a diesel engine."
      },
      {
        "icon": "âš¡",
        "title": "Deploy faster, wrap faster",
        "description": "Under 5 minutes to power on. No fuel logistics, no fire watch, no generator babysitting. Your crew focuses on the experience, not the power."
      }
    ]
  },
  "problem": {
    "title": "What experience agencies deal with today",
    "intro": "Generator drama kills brand moments and limits creative possibilities",
    "items": [
      {
        "title": "Venues say no",
        "description": "Noise, exhaust, insurance, fire code. Premium locations reject generators, limiting your creative options."
      },
      {
        "title": "Budget drain",
        "description": "Generator rentals ($500+/day) plus fuel, permits, and fire watch eat into activation budgets."
      },
      {
        "title": "Noise ruins moments",
        "description": "Generator noise competes with your activation, ruins video content, and damages the brand experience."
      },
      {
        "title": "Setup complexity",
        "description": "Generator logistics reduce time for actual experience design and execution."
      }
    ]
  },
  "solution": {
    "title": "How LAB SEVEN solves it",
    "items": [
      {
        "title": "Silent approval",
        "description": "Zero emissions, zero noise. Indoor-approved power opens previously impossible venues. Say yes to rooftop activations, hotel ballrooms, historic buildings, and retail spaces that prohibit generators."
      },
      {
        "title": "True cost savings",
        "description": "Cost-competitive with generators once you factor in permits, fuel, fire watch, and crew time. Transparent rental pricing includes delivery, pickup, and backup generator."
      },
      {
        "title": "White-glove service",
        "description": "Anytime Rentals handles delivery, placement, and pickup. You don't touch it. Your crew focuses on creating experiences, not managing power logistics."
      },
      {
        "title": "Real power",
        "description": "60A Bates out plus three 20A Edison circuits. Power full AV rigs, theatrical lighting, interactive elements, and charging stations simultaneously."
      }
    ]
  }
}
